{
  "$schema": ".adwf/schemas/creative-agent-adapters.schema.json",
  "schema_version": 1,
  "qualification_profile": {
    "id": "CREATIVE_AGENT_COMMAND_V1",
    "version": 1,
    "digest": "426dee8fd5063bb8f408d6ec3ab26e7c67d9c4a2e8d91b09174cb407bd515af8"
  },
  "adapters": [
    {
      "id": "reference-local",
      "version": "1.0.0",
      "kind": "REFERENCE_DETERMINISTIC",
      "invocation_mode": "COMMAND",
      "supported_phases": [
        "EXECUTE",
        "RECOVERY"
      ],
      "command": {
        "runner": "PYTHON",
        "path": ".adwf/scripts/reference_agent_adapter.py",
        "sha256": "db899b3cb9c12609d7c0d3fc2ccf57bf7c06aab90a1dbd39627e91fd930e434d"
      },
      "authority": {
        "network": "NONE",
        "secrets": "FORBIDDEN",
        "filesystem": "PACKAGE_SCOPED"
      },
      "monetary_budget_usd": 0,
      "timeout_seconds": 60,
      "result_channel": "ADWF_ACTION_RESULT_JSON",
      "package_schema": ".adwf/schemas/ai-work-package.schema.json",
      "result_schema": ".adwf/schemas/ai-work-result.schema.json",
      "qualification_report": ".adwf/creative-agent-qualification.json",
      "qualification_profile_id": "CREATIVE_AGENT_COMMAND_V1",
      "qualification_profile_version": 1,
      "qualification_profile_digest": "426dee8fd5063bb8f408d6ec3ab26e7c67d9c4a2e8d91b09174cb407bd515af8"
    },
    {
      "id": "openhands-local",
      "version": "1.0.0",
      "kind": "EXTERNAL_COMMAND",
      "invocation_mode": "COMMAND",
      "supported_phases": [
        "EXECUTE",
        "RECOVERY"
      ],
      "command": {
        "runner": "PYTHON",
        "path": ".adwf/scripts/openhands_agent_adapter.py",
        "sha256": "cd7951aaa7d7976ad6530831d01af8b40745ca146c00e5b179ab86140679e92e"
      },
      "authority": {
        "network": "DECLARED_EXTERNAL",
        "secrets": "FORBIDDEN",
        "filesystem": "PACKAGE_SCOPED"
      },
      "monetary_budget_usd": 0,
      "timeout_seconds": 900,
      "result_channel": "ADWF_ACTION_RESULT_JSON",
      "package_schema": ".adwf/schemas/ai-work-package.schema.json",
      "result_schema": ".adwf/schemas/ai-work-result.schema.json",
      "qualification_report": ".adwf/creative-agent-qualification-openhands-local.json",
      "qualification_profile_id": "CREATIVE_AGENT_COMMAND_V1",
      "qualification_profile_version": 1,
      "qualification_profile_digest": "426dee8fd5063bb8f408d6ec3ab26e7c67d9c4a2e8d91b09174cb407bd515af8"
    }
  ],
  "registry_sha256": "1706ce73a5eacb38cba70c1f47ff7b678d0369c52035630e7da812c933dc1c6c"
}
